{
  "job_id": "job-example-infra",
  "action": "apply_plan",
  "spec_sha256": "aaaaaaaaaaaaaaaaaaaaaaaaaaaaaaaaaaaaaaaaaaaaaaaaaaaaaaaaaaaaaaaa",
  "head_sha": "bbbbbbbbbbbbbbbbbbbbbbbbbbbbbbbbbbbbbbbb",
  "artifact_sha256": "cccccccccccccccccccccccccccccccccccccccccccccccccccccccccccccccc",
  "environment": "dev",
  "policy_version": "0.2.0",
  "checks_sha256": "dddddddddddddddddddddddddddddddddddddddddddddddddddddddddddddddd",
  "mode": "delivery",
  "mode_revision": 1,
  "learning_evidence_sha256": null
}
